{
  "$schema": "http://json-schema.org/draft-07/schema#",
  "title": "depth_chart",
  "description": "R77: each team's LATEST nflverse depth-chart snapshot for the positions the this-week gate reads (QB). Facts as listed: rank, name, ids. Written by build_predictions on every run (fresh pull), read by build_weekly.this_week_gate, the validator and the app. Runner-built; on a feed failure the last-good file stands in and feed health says so.",
  "type": "object",
  "additionalProperties": false,
  "required": [
    "season",
    "updated_utc",
    "source",
    "positions",
    "counts",
    "teams"
  ],
  "properties": {
    "season": {
      "type": "integer",
      "minimum": 2020
    },
    "updated_utc": {
      "type": "string",
      "pattern": "^\\d{4}-\\d{2}-\\d{2}T\\d{2}:\\d{2}:\\d{2}Z$"
    },
    "source": {
      "type": "string",
      "minLength": 1
    },
    "positions": {
      "type": "array",
      "minItems": 1,
      "items": {
        "type": "string",
        "enum": [
          "QB"
        ]
      }
    },
    "counts": {
      "type": "object",
      "additionalProperties": false,
      "required": [
        "teams",
        "rows"
      ],
      "properties": {
        "teams": {
          "type": "integer",
          "minimum": 1
        },
        "rows": {
          "type": "integer",
          "minimum": 1
        }
      }
    },
    "teams": {
      "type": "object",
      "minProperties": 1,
      "additionalProperties": {
        "type": "object",
        "additionalProperties": false,
        "required": [
          "snapshot"
        ],
        "properties": {
          "snapshot": {
            "type": "string",
            "minLength": 1,
            "description": "The team's latest depth-chart `dt`."
          },
          "QB": {
            "type": "array",
            "minItems": 1,
            "items": {
              "type": "object",
              "additionalProperties": false,
              "required": [
                "rank",
                "name",
                "gsis_id",
                "espn_id"
              ],
              "properties": {
                "rank": {
                  "type": "integer",
                  "minimum": 1
                },
                "name": {
                  "type": "string",
                  "minLength": 1
                },
                "gsis_id": {
                  "type": [
                    "string",
                    "null"
                  ]
                },
                "espn_id": {
                  "type": [
                    "string",
                    "null"
                  ]
                }
              }
            }
          }
        }
      }
    }
  }
}
