{
  "season": 2026,
  "updated_utc": "2026-10-19T00:00:16Z",
  "source": "nflverse_depth_charts_2026 (per-team latest snapshot; positions QB)",
  "positions": [
    "QB"
  ],
  "counts": {
    "teams": 32,
    "rows": 94
  },
  "teams": {
    "ARI": {
      "snapshot": "2026-10-18T12:02:37Z",
      "QB": [
        {
          "rank": 1,
          "name": "Jacoby Brissett",
          "gsis_id": "00-0033119",
          "espn_id": "2578570"
        },
        {
          "rank": 2,
          "name": "Gardner Minshew II",
          "gsis_id": "00-0035289",
          "espn_id": "4038524"
        },
        {
          "rank": 3,
          "name": "Carson Beck",
          "gsis_id": "00-0041561",
          "espn_id": "4430841"
        }
      ]
    },
    "ATL": {
      "snapshot": "2026-10-18T12:02:37Z",
      "QB": [
        {
          "rank": 1,
          "name": "Michael Penix Jr.",
          "gsis_id": "00-0039917",
          "espn_id": "4360423"
        },
        {
          "rank": 2,
          "name": "Tua Tagovailoa",
          "gsis_id": "00-0036212",
          "espn_id": "4241479"
        },
        {
          "rank": 3,
          "name": "Cooper Rush",
          "gsis_id": "00-0033662",
          "espn_id": "2972515"
        },
        {
          "rank": 4,
          "name": "Jack Strand",
          "gsis_id": "00-0041194",
          "espn_id": "5344782"
        }
      ]
    },
    "BAL": {
      "snapshot": "2026-10-18T12:02:37Z",
      "QB": [
        {
          "rank": 1,
          "name": "Lamar Jackson",
          "gsis_id": "00-0034796",
          "espn_id": "3916387"
        },
        {
          "rank": 2,
          "name": "Tyler Huntley",
          "gsis_id": "00-0035993",
          "espn_id": "4035671"
        },
        {
          "rank": 3,
          "name": "Joe Fagnano",
          "gsis_id": "00-0040981",
          "espn_id": "4429582"
        },
        {
          "rank": 4,
          "name": "Skylar Thompson",
          "gsis_id": "00-0037327",
          "espn_id": "4036419"
        }
      ]
    },
    "BUF": {
      "snapshot": "2026-10-18T12:02:37Z",
      "QB": [
        {
          "rank": 1,
          "name": "Josh Allen",
          "gsis_id": "00-0034857",
          "espn_id": "3918298"
        },
        {
          "rank": 2,
          "name": "Kyle Allen",
          "gsis_id": "00-0034577",
          "espn_id": "3115293"
        }
      ]
    },
    "CAR": {
      "snapshot": "2026-10-18T12:02:37Z",
      "QB": [
        {
          "rank": 1,
          "name": "Bryce Young",
          "gsis_id": "00-0039150",
          "espn_id": "4685720"
        },
        {
          "rank": 2,
          "name": "Kenny Pickett",
          "gsis_id": "00-0038102",
          "espn_id": "4240703"
        },
        {
          "rank": 3,
          "name": "Haynes King",
          "gsis_id": "00-0041149",
          "espn_id": "4428993"
        }
      ]
    },
    "CHI": {
      "snapshot": "2026-10-18T12:02:37Z",
      "QB": [
        {
          "rank": 1,
          "name": "Caleb Williams",
          "gsis_id": "00-0039918",
          "espn_id": "4431611"
        },
        {
          "rank": 2,
          "name": "Tyson Bagent",
          "gsis_id": "00-0038416",
          "espn_id": "4434153"
        },
        {
          "rank": 3,
          "name": "Case Keenum",
          "gsis_id": "00-0028986",
          "espn_id": "15168"
        }
      ]
    },
    "CIN": {
      "snapshot": "2026-10-18T12:02:37Z",
      "QB": [
        {
          "rank": 1,
          "name": "Joe Burrow",
          "gsis_id": "00-0036442",
          "espn_id": "3915511"
        },
        {
          "rank": 2,
          "name": "Joe Flacco",
          "gsis_id": "00-0026158",
          "espn_id": "11252"
        }
      ]
    },
    "CLE": {
      "snapshot": "2026-10-18T12:02:37Z",
      "QB": [
        {
          "rank": 1,
          "name": "Deshaun Watson",
          "gsis_id": "00-0033537",
          "espn_id": "3122840"
        },
        {
          "rank": 2,
          "name": "Shedeur Sanders",
          "gsis_id": "00-0040668",
          "espn_id": "4432762"
        },
        {
          "rank": 3,
          "name": "Taylen Green",
          "gsis_id": "00-0041092",
          "espn_id": "4431325"
        },
        {
          "rank": 4,
          "name": "Dillon Gabriel",
          "gsis_id": "00-0040704",
          "espn_id": "4427238"
        }
      ]
    },
    "DAL": {
      "snapshot": "2026-10-18T12:02:37Z",
      "QB": [
        {
          "rank": 1,
          "name": "Dak Prescott",
          "gsis_id": "00-0033077",
          "espn_id": "2577417"
        },
        {
          "rank": 2,
          "name": "Sam Howell",
          "gsis_id": "00-0037077",
          "espn_id": "4426875"
        }
      ]
    },
    "DEN": {
      "snapshot": "2026-10-18T12:02:37Z",
      "QB": [
        {
          "rank": 1,
          "name": "Bo Nix",
          "gsis_id": "00-0039732",
          "espn_id": "4426338"
        },
        {
          "rank": 2,
          "name": "Jarrett Stidham",
          "gsis_id": "00-0035264",
          "espn_id": "3892775"
        },
        {
          "rank": 3,
          "name": "Sam Ehlinger",
          "gsis_id": "00-0036879",
          "espn_id": "4241820"
        }
      ]
    },
    "DET": {
      "snapshot": "2026-10-18T12:02:37Z",
      "QB": [
        {
          "rank": 1,
          "name": "Jared Goff",
          "gsis_id": "00-0033106",
          "espn_id": "3046779"
        },
        {
          "rank": 2,
          "name": "Joshua Dobbs",
          "gsis_id": "00-0033949",
          "espn_id": "3044720"
        }
      ]
    },
    "GB": {
      "snapshot": "2026-10-18T12:02:37Z",
      "QB": [
        {
          "rank": 1,
          "name": "Jordan Love",
          "gsis_id": "00-0036264",
          "espn_id": "4036378"
        },
        {
          "rank": 2,
          "name": "Tyrod Taylor",
          "gsis_id": "00-0028118",
          "espn_id": "14163"
        }
      ]
    },
    "HOU": {
      "snapshot": "2026-10-18T12:02:37Z",
      "QB": [
        {
          "rank": 1,
          "name": "C.J. Stroud",
          "gsis_id": "00-0039163",
          "espn_id": "4432577"
        },
        {
          "rank": 2,
          "name": "Davis Mills",
          "gsis_id": "00-0036898",
          "espn_id": "4242546"
        },
        {
          "rank": 3,
          "name": "Graham Mertz",
          "gsis_id": "00-0040211",
          "espn_id": "4426335"
        }
      ]
    },
    "IND": {
      "snapshot": "2026-10-18T12:02:37Z",
      "QB": [
        {
          "rank": 1,
          "name": "Daniel Jones",
          "gsis_id": "00-0035710",
          "espn_id": "3917792"
        },
        {
          "rank": 2,
          "name": "Anthony Richardson Sr.",
          "gsis_id": "00-0039164",
          "espn_id": "4429084"
        },
        {
          "rank": 3,
          "name": "Riley Leonard",
          "gsis_id": "00-0040206",
          "espn_id": "4683423"
        }
      ]
    },
    "JAX": {
      "snapshot": "2026-10-18T12:02:37Z",
      "QB": [
        {
          "rank": 1,
          "name": "Trevor Lawrence",
          "gsis_id": "00-0036971",
          "espn_id": "4360310"
        },
        {
          "rank": 2,
          "name": "Quinn Ewers",
          "gsis_id": "00-0040234",
          "espn_id": "4889929"
        }
      ]
    },
    "KC": {
      "snapshot": "2026-10-18T12:02:37Z",
      "QB": [
        {
          "rank": 1,
          "name": "Patrick Mahomes",
          "gsis_id": "00-0033873",
          "espn_id": "3139477"
        },
        {
          "rank": 2,
          "name": "Justin Fields",
          "gsis_id": "00-0036945",
          "espn_id": "4362887"
        },
        {
          "rank": 3,
          "name": "Garrett Nussmeier",
          "gsis_id": "00-0040906",
          "espn_id": "4567747"
        }
      ]
    },
    "LAC": {
      "snapshot": "2026-10-18T12:02:37Z",
      "QB": [
        {
          "rank": 1,
          "name": "Justin Herbert",
          "gsis_id": "00-0036355",
          "espn_id": "4038941"
        },
        {
          "rank": 2,
          "name": "DJ Uiagalelei",
          "gsis_id": "00-0040464",
          "espn_id": "4429020"
        },
        {
          "rank": 3,
          "name": "Trey Lance",
          "gsis_id": "00-0037012",
          "espn_id": "4383351"
        }
      ]
    },
    "LAR": {
      "snapshot": "2026-10-18T12:02:37Z",
      "QB": [
        {
          "rank": 1,
          "name": "Matthew Stafford",
          "gsis_id": "00-0026498",
          "espn_id": "12483"
        },
        {
          "rank": 2,
          "name": "Stetson Bennett IV",
          "gsis_id": "00-0039107",
          "espn_id": "4259553"
        },
        {
          "rank": 3,
          "name": "Ty Simpson",
          "gsis_id": "00-0041568",
          "espn_id": "4685522"
        },
        {
          "rank": 4,
          "name": "Matthew Caldwell",
          "gsis_id": "00-0041414",
          "espn_id": "4877717"
        }
      ]
    },
    "LV": {
      "snapshot": "2026-10-18T12:02:37Z",
      "QB": [
        {
          "rank": 1,
          "name": "Kirk Cousins",
          "gsis_id": "00-0029604",
          "espn_id": "14880"
        },
        {
          "rank": 2,
          "name": "Fernando Mendoza",
          "gsis_id": "00-0041562",
          "espn_id": "4837248"
        },
        {
          "rank": 3,
          "name": "Aidan O'Connell",
          "gsis_id": "00-0038579",
          "espn_id": "4260394"
        }
      ]
    },
    "MIA": {
      "snapshot": "2026-10-18T12:02:37Z",
      "QB": [
        {
          "rank": 1,
          "name": "Malik Willis",
          "gsis_id": "00-0038128",
          "espn_id": "4242512"
        },
        {
          "rank": 2,
          "name": "Kyle McCord",
          "gsis_id": "00-0040014",